<?xml version="1.0" encoding="UTF-8"?>
<xs:schema xmlns:xs="http://www.w3.org/2001/XMLSchema">
	<xs:element name="pcBreathBonus">
		<xs:complexType>
			<xs:sequence minOccurs="1" maxOccurs="1">
				<xs:element name="breathBonus" minOccurs="1" maxOccurs="20">
					<xs:complexType>
						<xs:attribute name="classId" use="required">
							<xs:simpleType>
								<xs:restriction base="xs:nonNegativeInteger">
									<xs:enumeration value="0" />
									<xs:enumeration value="10" />
									<xs:enumeration value="18" />
									<xs:enumeration value="25" />
									<xs:enumeration value="31" />
									<xs:enumeration value="38" />
									<xs:enumeration value="44" />
									<xs:enumeration value="49" />
									<xs:enumeration value="53" />
									<xs:enumeration value="123" />
									<xs:enumeration value="124" />
								</xs:restriction>
							</xs:simpleType>
						</xs:attribute>
						<xs:attribute name="sex" use="required">
							<xs:simpleType>
								<xs:restriction base="xs:token">
									<xs:enumeration value="female" />
									<xs:enumeration value="male" />
								</xs:restriction>
							</xs:simpleType>
						</xs:attribute>
						<xs:attribute name="val" type="xs:nonNegativeInteger" use="required" />
					</xs:complexType>
				</xs:element>
			</xs:sequence>
		</xs:complexType>
	</xs:element>
</xs:schema>