<?xml version="1.0" encoding="UTF-8"?>
<pcBreathBonus xmlns:xsi="http://www.w3.org/2001/XMLSchema-instance" xsi:noNamespaceSchemaLocation="../../../xsd/pcBreathBonus.xsd">
	<breathBonus classId="0" sex="female" val="100" /> <!-- 100% --> <!-- Female Human Fighter -->
	<breathBonus classId="0" sex="male" val="100" /> <!-- 100% --> <!-- Male Human Fighter -->
	<breathBonus classId="10" sex="female" val="100" /> <!-- 100% --> <!-- Female Human Mystic -->
	<breathBonus classId="10" sex="male" val="100" /> <!-- 100% --> <!-- Male Human Mystic -->
	<breathBonus classId="18" sex="female" val="150" /> <!-- 150% --> <!-- Female Elven Fighter -->
	<breathBonus classId="18" sex="male" val="150" /> <!-- 150% --> <!-- Male Elven Fighter -->
	<breathBonus classId="25" sex="female" val="150" /> <!-- 150% --> <!-- Female Elven Mystic -->
	<breathBonus classId="25" sex="male" val="150" /> <!-- 150% --> <!-- Male Elven Mystic -->
	<breathBonus classId="31" sex="female" val="150" /> <!-- 150% --> <!-- Female Dark Fighter -->
	<breathBonus classId="31" sex="male" val="150" /> <!-- 150% --> <!-- Male Dark Fighter -->
	<breathBonus classId="38" sex="female" val="150" /> <!-- 150% --> <!-- Female Dark Mystic -->
	<breathBonus classId="38" sex="male" val="150" /> <!-- 150% --> <!-- Male Dark Mystic -->
	<breathBonus classId="44" sex="female" val="90" /> <!-- 90% --> <!-- Female Orc Fighter -->
	<breathBonus classId="44" sex="male" val="90" /> <!-- 90% --> <!-- Male Orc Fighter -->
	<breathBonus classId="49" sex="female" val="90" /> <!-- 90% --> <!-- Female Orc Mystic -->
	<breathBonus classId="49" sex="male" val="90" /> <!-- 90% --> <!-- Male Orc Mystic -->
	<breathBonus classId="53" sex="female" val="80" /> <!-- 80% --> <!-- Female Dwarven Fighter -->
	<breathBonus classId="53" sex="male" val="80" /> <!-- 80% --> <!-- Male Dwarven Fighter -->
	<breathBonus classId="124" sex="female" val="100" /> <!-- 100% --> <!-- Female Soldier -->
	<breathBonus classId="123" sex="male" val="100" /> <!-- 100% --> <!-- Male Male Soldier -->
</pcBreathBonus>